{"$schema":"https://json-schema.org/draft/2020-12/schema","$id":"backlog.schema.json","type":"object","required":["schema_version","source","summary","ordered_ids","next_ready","note"],"properties":{"$schema":{"type":"string"},"schema_version":{"type":"string","const":"1.0.0"},"source":{"type":"string","minLength":1},"summary":{"type":"object"},"ordered_ids":{"type":"array","uniqueItems":true,"items":{"type":"string","pattern":"^WI-[0-9]{3}$"}},"next_ready":{"type":["string","null"]},"note":{"type":"string"}},"additionalProperties":false}
